{
  "book_code": "SYNTH",
  "edition_id": "SYNTH-EDITION-1",
  "grade": 2,
  "manifest_id": "SYNTH-MANIFEST-1",
  "manifest_path": "authoring/agent/fixtures/content_pipeline_synthetic/manifest.json",
  "manifest_sha256": "0c178294dd7ff776b73ad70324e79f46e589e65197a52558253014cdf44452b9",
  "pagination": {
    "body_pdf_page_end": 11,
    "body_pdf_page_start": 10,
    "book_page_end": 2,
    "book_page_start": 1,
    "offset_proof_path": "authoring/agent/fixtures/content_pipeline_synthetic/offset-proof.json",
    "offset_proof_sha256": "04de53114725f414365f95e91776c2aa171a93ee83534a28366f9789f5a45f22",
    "offset_proof_status": "SYNTHETIC_TEST_ONLY",
    "pdf_minus_book_offset": 9
  },
  "pdf_page_count": 12,
  "rights_status": "SYNTHETIC_TEST_ONLY",
  "schema_version": "khshab.content-source/v1",
  "source_asset": {
    "locator_ref": "private://synthetic-fixture/SYNTH-PRINT-1",
    "storage": "PRIVATE_EXTERNAL"
  },
  "source_id": "SYNTH-PRINT-1",
  "source_pdf_sha256": "b49bc5ae360c4f501f264c37b73f5d6b3772b09491b1a67ea9376e0b360f9f56",
  "source_pdf_size_bytes": 8123,
  "subject_id": "math"
}
